title,release_year,parental_rating,movie_duration,movie_rating,description,genres,budget,gross_na,gross_worldwide
Me Before You,2016,PG-13,1h 50m,7.4,A girl in a small town forms an unlikely bond with a recently-paralyzed man she's taking care of.,"Drama,Romance","$20,000,000 (estimated)","$56,245,075","$208,445,075"
Cloud Atlas,2012,R,2h 52m,7.4,"An exploration of how the actions of individual lives impact one another in the past, present and future, as one soul is shaped from a killer into a hero, and an act of kindness ripples acro...","Drama,Mystery,Sci-Fi","$102,000,000 (estimated)","$27,108,272","$130,516,424"
Pirates of the Caribbean: Dead Man's Chest,2006,PG-13,2h 31m,7.4,"Jack Sparrow races to recover the heart of Davy Jones to avoid enslaving his soul to Jones' service, as other friends and foes seek the heart for their own agenda as well.","Action,Adventure,Fantasy","$225,000,000 (estimated)","$423,315,812","$1,066,179,747"
Frozen,2013,PG,1h 42m,7.4,"Fearless optimist Anna teams up with rugged mountain man Kristoff and his loyal reindeer Sven in an epic journey to find Anna's sister Elsa, whose icy powers have trapped the kingdom of Aren...","Animation,Adventure,Comedy","$150,000,000 (estimated)","$400,953,009","$1,397,045,694"
Bram Stoker's Dracula,1992,R,2h 8m,7.4,The centuries old vampire Count Dracula comes to England to seduce his barrister Jonathan Harker's fiancée Mina Murray and inflict havoc in the foreign land.,"Drama,Fantasy,Horror","$40,000,000 (estimated)","$82,522,790","$215,862,692"
Scream,1996,R,1h 51m,7.4,"A year after the murder of her mother, a teenage girl is terrorized by a masked killer who targets her and her friends by using scary movies as part of a deadly game.","Horror,Mystery","$14,000,000 (estimated)","$103,046,663","$173,046,663"
Beautiful Boy,2018,R,2h,7.4,"Based on the best-selling pair of memoirs from father and son David and Nic Sheff, Beautiful Boy chronicles the heartbreaking and inspiring experience of survival, relapse and recovery in a ...","Biography,Drama","$25,000,000 (estimated)","$7,649,973","$31,749,905"
Nobody,2021,R,1h 32m,7.4,"A docile family man slowly reveals his true character after his house gets burgled by two petty thieves, which, coincidentally, leads him into a bloody war with a Russian crime boss.","Action,Crime,Drama","$16,000,000 (estimated)","$27,568,035","$57,510,518"
Ready Player One,2018,PG-13,2h 20m,7.4,"When the creator of a virtual reality called the OASIS dies, he makes a posthumous challenge to all OASIS users to find his Easter Egg, which will give the finder his fortune and control of ...","Action,Adventure,Sci-Fi","$175,000,000 (estimated)","$137,715,350","$607,874,422"
The Nice Guys,2016,R,1h 56m,7.4,"In 1970s Los Angeles, a mismatched pair of private eyes investigate a missing girl and the mysterious death of a porn star.","Action,Comedy,Crime","$50,000,000 (estimated)","$36,261,763","$71,261,763"
Molly's Game,2017,R,2h 20m,7.4,"The true story of Molly Bloom, an Olympic-class skier who ran the world's most exclusive high-stakes poker game and became an FBI target.","Biography,Crime,Drama","$30,000,000 (estimated)","$28,780,744","$59,284,015"
The English Patient,1996,R,2h 42m,7.4,"At the close of World War II, a young nurse tends to a badly burned plane crash victim. His past is shown in flashbacks, revealing an involvement in a fateful love affair.","Drama,Romance,War","$27,000,000 (estimated)","$78,676,425","$231,976,425"
Juno,2007,PG-13,1h 36m,7.4,"Faced with an unplanned pregnancy, an offbeat young woman makes a selfless decision regarding the unborn child.","Comedy,Drama","$7,500,000 (estimated)","$143,495,265","$232,372,830"
Lady Bird,2017,R,1h 34m,7.4,"In 2002, an artistically inclined 17-year-old girl comes of age in Sacramento, California.","Comedy,Drama","$10,000,000 (estimated)","$48,958,273","$78,987,280"
BlackBerry,2023,R,2h,7.4,The story of the meteoric rise and catastrophic demise of the world's first smartphone.,"Biography,Comedy,Drama","$1,476,597","$492,145","$2,047,650"
Erin Brockovich,2000,R,2h 11m,7.4,An unemployed single mother becomes a legal assistant and almost single-handedly brings down a California power company accused of polluting a city's water supply.,"Biography,Drama","$52,000,000 (estimated)","$125,595,205","$256,271,286"
John Wick,2014,R,1h 41m,7.4,An ex-hitman comes out of retirement to track down the gangsters who killed his dog and stole his car.,"Action,Crime,Thriller","$20,000,000 (estimated)","$43,037,835","$86,081,850"
Beverly Hills Cop,1984,R,1h 45m,7.4,A freewheeling Detroit cop pursuing a murder investigation finds himself dealing with the very different culture of Beverly Hills.,"Action,Comedy,Crime","$13,000,000 (estimated)","$234,760,478","$316,360,478"
"Crazy, Stupid, Love.",2011,PG-13,1h 58m,7.4,"A middle-aged husband's life changes dramatically when his wife asks him for a divorce. He seeks to rediscover his manhood with the help of a newfound friend, Jacob, learning to pick up girl...","Comedy,Drama,Romance","$50,000,000 (estimated)","$84,379,584","$145,086,643"
Spy x Family Code: White,2023,PG-13,1h 50m,7.4,"After receiving an order to be replaced in Operation Strix, Loid decides to help Anya win a cooking competition at Eden Academy, by making the director's favorite meal in order to prevent hi...","Animation,Action,Comedy","$6,260,120","$4,824,993","$53,257,961"
Spider-Man,2002,PG-13,2h 1m,7.4,"After being bitten by a genetically-modified spider, a shy teenager gains spider-like abilities that he uses to fight injustice as a masked superhero and face a vengeful enemy.","Action,Adventure,Sci-Fi","$139,000,000 (estimated)","$407,725,644","$825,727,820"
War for the Planet of the Apes,2017,PG-13,2h 20m,7.4,"After the apes suffer unimaginable losses, Caesar wrestles with his darker instincts and begins his own mythic quest to avenge his kind.","Action,Adventure,Drama","$150,000,000 (estimated)","$146,880,162","$490,719,763"
The Fall Guy,2024,PG-13,2h 6m,7.4,A down-and-out stuntman must find the missing star of his ex-girlfriend's blockbuster film.,"Action,Comedy,Drama","$125,000,000 (estimated)",,
Ordinary Angels,2024,PG,1h 58m,7.4,Inspired by the incredible true story of a hairdresser who single-handedly rallies an entire community to help a widowed father save the life of his critically ill young daughter.,Drama,"$19,174,421","$6,163,600","$19,454,580"
The Talented Mr. Ripley,1999,R,2h 19m,7.4,"In late 1950s New York, a young underachiever named Tom Ripley is sent to Italy to retrieve Dickie Greenleaf, a rich and spoiled millionaire playboy. But when the errand fails, Ripley takes ...","Crime,Drama,Thriller","$40,000,000 (estimated)","$81,298,265","$128,801,965"
Brothers,2009,R,1h 45m,7.1,"While on tour in Afghanistan, Sam's helicopter is shot down and he is presumed dead. Back home, it is his screw-up brother who looks after the family. Sam does return, but with a lot of exce...","Drama,Thriller,War","$26,000,000 (estimated)","$28,544,157","$43,474,578"
The Ring,2002,PG-13,1h 55m,7.1,A journalist must investigate a mysterious videotape which seems to cause the death of anyone one week to the day after they view it.,"Horror,Mystery","$48,000,000 (estimated)","$129,128,133","$249,348,933"
Vicky Cristina Barcelona,2008,PG-13,1h 36m,7.1,"Two friends on a summer holiday in Spain become enamored with the same painter, unaware that his ex-wife, with whom he has a tempestuous relationship, is about to re-enter the picture.","Comedy,Drama,Romance","$15,500,000 (estimated)","$23,216,709","$96,409,830"
Fighting with My Family,2019,PG-13,1h 48m,7.1,A former wrestler and his family make a living performing at small venues around the country while his kids dream of joining World Wrestling Entertainment.,"Biography,Comedy,Drama","$11,000,000 (estimated)","$22,958,886","$41,503,392"
Everest,2015,PG-13,2h 1m,7.1,"On May 10, 1996, mountain guides Rob Hall and Scott Fischer combine their expedition teams for a final ascent to the summit of Mount Everest. With little warning, a storm strikes the mountai...","Action,Adventure,Biography","$55,000,000 (estimated)","$43,482,270","$203,427,584"
Cashback,2006,R,1h 42m,7.1,"After a painful breakup, Ben develops insomnia. To kill time, he starts working the late night shift at the local supermarket, where his artistic imagination runs wild.","Comedy,Drama,Romance","$25,343","$14,878","$2,294,291"
West Side Story,2021,PG-13,2h 36m,7.1,"An adaptation of the 1957 musical, West Side Story explores forbidden love and the rivalry between the Jets and the Sharks, two teenage street gangs of different ethnic backgrounds.","Crime,Drama,Musical","$100,000,000 (estimated)","$38,530,322","$76,016,171"
Melancholia,2011,R,2h 15m,7.1,Two sisters find their already strained relationship challenged as a mysterious new planet threatens to collide with Earth.,"Drama,Sci-Fi","$7,400,000 (estimated)","$3,030,848","$17,505,929"
Pirates of the Caribbean: At World's End,2007,PG-13,2h 49m,7.1,"Captain Barbossa, Will Turner and Elizabeth Swann must sail off the edge of the map, navigate treachery and betrayal, find Jack Sparrow, and make their final alliances for one last decisive ...","Action,Adventure,Fantasy","$300,000,000 (estimated)","$309,420,425","$961,691,209"
Deja Vu,2006,PG-13,2h 6m,7.1,"After a ferry is bombed in New Orleans, an A.T.F. agent joins a unique investigation using experimental surveillance technology to find the bomber, but soon finds himself becoming obsessed w...","Action,Crime,Sci-Fi","$75,000,000 (estimated)","$64,038,616","$180,557,550"
Tommy Boy,1995,PG-13,1h 37m,7.1,"After his auto-parts tycoon father dies, the overweight, underachieving son teams up with a snide accountant to try and save the family business.","Adventure,Comedy","$20,000,000 (estimated)","$32,679,899","$32,679,899"
Remember Me,2010,PG-13,1h 53m,7.1,"A romantic drama centred on two new lovers: Tyler, whose parents have split in the wake of his brother's suicide, and Ally, who lives each day to the fullest since witnessing her mother's mu...","Drama,Romance","$16,000,000 (estimated)","$19,068,240","$56,032,889"
Shooter,2007,R,2h 4m,7.1,"A marksman living in exile is coaxed back into action after hearing of a plot to kill the President. After being-double crossed for the attempt and on the run, he sets out for the real kille...","Action,Drama,Thriller","$61,000,000 (estimated)","$47,003,582","$95,696,996"
Beauty and the Beast,2017,PG,2h 9m,7.1,"A selfish Prince is cursed to become a monster for the rest of his life, unless he learns to fall in love with a beautiful young woman he keeps prisoner.","Adventure,Family,Fantasy","$160,000,000 (estimated)","$504,481,165","$1,266,115,964"
Hard Miles,2023,PG-13,1h 48m,7.1,"A prison social worker assembles a cycling team of teenage convicts and takes them on a transformative 1,000-mile ride. Inspired by the life of Greg Townsend and the Ridgeview Academy cyclin...","Drama,Sport","$299,853","$204,134","$299,853"
Man of Steel,2013,PG-13,2h 23m,7.1,An alien child is evacuated from his dying world and sent to Earth to live among humans. His peace is threatened when other survivors of his home planet invade Earth.,"Action,Adventure,Sci-Fi","$225,000,000 (estimated)","$291,045,518","$670,145,518"
Blade,1998,R,2h,7.1,"A half-vampire, half-mortal man becomes a protector of the mortal race, while slaying evil vampires.","Action,Horror,Sci-Fi","$45,000,000 (estimated)","$70,087,718","$131,211,411"
Deepwater Horizon,2016,PG-13,1h 47m,7.1,"A dramatization of the disaster in April 2010, when the offshore drilling rig called the Deepwater Horizon exploded, resulting in the worst oil spill in American history.","Action,Drama,History","$110,000,000 (estimated)","$61,433,527","$121,790,373"
Dredd,2012,R,1h 35m,7.1,"In a violent, futuristic city where the police have the authority to act as judge, jury and executioner, a cop teams with a trainee to take down a gang that deals the reality-altering drug, ...","Action,Crime,Sci-Fi","$50,000,000 (estimated)","$13,414,714","$41,037,742"
Jumanji,1995,PG,1h 44m,7.1,"When two kids find and play a magical board game, they release a man trapped in it for decades - and a host of dangers that can only be stopped by finishing the game.","Adventure,Comedy,Family","$65,000,000 (estimated)","$100,499,940","$262,821,940"
Prey,2022,R,1h 40m,7.1,"Naru, a skilled warrior of the Comanche Nation, fights to protect her tribe against one of the first highly-evolved Predators to land on Earth.","Action,Adventure,Horror","$65,000,000 (estimated)",,
Fast Times at Ridgemont High,1982,R,1h 30m,7.1,"A group of Southern California high school students are enjoying their most important subjects: sex, drugs and rock n' roll.","Comedy,Drama","$4,500,000 (estimated)","$27,092,880","$27,093,151"
Pretty Woman,1990,R,1h 59m,7.1,"A man in a legal but hurtful business needs an escort for some social events, and hires a beautiful prostitute he meets... only to fall in love.","Comedy,Romance","$14,000,000 (estimated)","$178,406,268","$463,406,268"
Nyad,2023,PG-13,2h 1m,7.1,"The remarkable true story of athlete Diana Nyad who, at the age of 60 and with the help of her best friend and coach, commits to achieving her life-long dream: a 110-mile open ocean swim fro...","Biography,Drama,Sport","$16,056",,
Glass Onion,2022,PG-13,2h 19m,7.1,"Tech billionaire Miles Bron invites his friends for a getaway on his private Greek island. When someone turns up dead, Detective Benoit Blanc is put on the case.","Comedy,Crime,Drama","$40,000,000 (estimated)","$13,280,000","$13,280,000"
Tropic Thunder,2008,R,1h 47m,7.1,"Through a series of freak occurrences, a group of actors shooting a big-budget war movie are forced to become the soldiers they are portraying.","Action,Comedy,War","$92,000,000 (estimated)","$110,515,313","$195,703,351"
Guys and Dolls,1955,Approved,2h 30m,7.1,"In New York, a gambler is challenged to take a cold female missionary to Havana, but they fall for each other, and the bet has a hidden motive to finance a crap game.","Comedy,Crime,Musical","$5,500,000 (estimated)","$3,791",
Never Let Me Go,2010,R,1h 43m,7.1,"The lives of three friends, from their early school days into young adulthood, when the reality of the world they live in comes knocking.","Drama,Romance,Sci-Fi","$15,000,000 (estimated)","$2,434,652","$9,918,093"
Pitch Perfect,2012,PG-13,1h 52m,7.1,"Beca, a freshman at Barden University, is cajoled into joining The Bellas, her school's all-girls singing group. Injecting some much needed energy into their repertoire, The Bellas take on t...","Comedy,Music,Romance","$17,000,000 (estimated)","$65,298,093","$115,647,737"
Kung Fu Panda 3,2016,PG,1h 35m,7.1,"Continuing his ""legendary adventures of awesomeness"", Po must face two hugely epic, but different threats: one supernatural and the other a little closer to home.","Animation,Action,Adventure","$145,000,000 (estimated)","$143,528,619","$521,170,825"
Basic Instinct,1992,R,2h 7m,7.1,A violent police detective investigates a brutal murder that might involve a manipulative and seductive novelist.,"Drama,Mystery,Thriller","$49,000,000 (estimated)","$117,727,224","$352,927,224"
The Mist,2007,R,2h 6m,7.1,"A freak storm unleashes a species of bloodthirsty creatures on a small town, where a small band of citizens hole up in a supermarket and fight for their lives.","Horror,Sci-Fi,Thriller","$18,000,000 (estimated)","$25,594,957","$57,470,220"
The Mummy,1999,PG-13,2h 4m,7.1,"At an archaeological dig in the ancient city of Hamunaptra, an American serving in the French Foreign Legion accidentally awakens a mummy who begins to wreak havoc as he searches for the rei...","Action,Adventure,Fantasy","$80,000,000 (estimated)","$155,886,138","$416,434,056"
Gran Turismo,2023,PG-13,2h 14m,7.1,"Based on the unbelievable, inspiring true story of a team of underdogs - a struggling, working-class gamer, a failed former race car driver, and an idealistic motorsport exec - who risk it a...","Action,Adventure,Drama","$60,000,000 (estimated)","$44,428,554","$122,101,055"
The Dreamers,2003,NC-17,1h 55m,7.1,A young American studying in Paris in 1968 strikes up a friendship with a French brother and sister. Set against the background of the '68 Paris student riots.,"Drama,Romance","$15,000,000 (estimated)","$2,532,228","$24,152,155"
Wrath of Man,2021,R,1h 59m,7.1,A cold and mysterious character working at a cash truck company responsible for moving a lot of money around Los Angeles each week.,"Action,Crime,Thriller","$40,000,000 (estimated)","$27,466,489","$103,966,489"
The Lobster,2015,R,1h 59m,7.1,"In a dystopian near future, according to the laws of The City, single people are taken to The Hotel, where they are obliged to find a romantic partner in 45 days or they're transformed into ...","Drama,Romance,Sci-Fi","€4,000,000 (estimated)","$9,077,245","$17,581,104"
Babylon,2022,R,3h 9m,7.1,"A tale of outsized ambition and outrageous excess, it traces the rise and fall of multiple characters during an era of unbridled decadence and depravity in early Hollywood.","Comedy,Drama,History","$110,000,000 (estimated)","$15,351,455","$63,562,440"
The 40-Year-Old Virgin,2005,R,1h 56m,7.1,"Goaded by his buddies, a nerdy guy who's never ""done the deed"" only finds the pressure mounting when he meets a single mother.","Comedy,Romance","$26,000,000 (estimated)","$109,449,237","$177,378,645"
Bone Tomahawk,2015,Not Rated,2h 12m,7.1,"In the dying days of the old west, an elderly sheriff and his posse set out to rescue their town's doctor from cannibalistic cave dwellers.","Drama,Horror,Western","$1,800,000 (estimated)","$382,579",
Evil Does Not Exist,2023,,1h 46m,7.1,"Takumi and his daughter Hana live in Mizubiki Village, close to Tokyo. One day, the village inhabitants become aware of a plan to build a camping site near Takumi's house offering city resid...",Drama,"$1,446,054",,
Mean Girls,2004,PG-13,1h 37m,7.1,"Cady Heron is a hit with The Plastics, the A-list girl clique at her new school, until she makes the mistake of falling for Aaron Samuels, the ex-boyfriend of alpha Plastic Regina George.",Comedy,"$17,000,000 (estimated)","$86,058,055","$130,160,481"
Late Night with the Devil,2023,R,1h 33m,7.1,"A live television broadcast in 1977 goes horribly wrong, unleashing evil into the nation's living rooms.",Horror,"$9,740,464","$2,834,867","$10,789,125"
Midsommar,2019,R,2h 28m,7.1,A couple travels to Northern Europe to visit a rural hometown's fabled Swedish mid-summer festival. What begins as an idyllic retreat quickly devolves into an increasingly violent and bizarr...,"Drama,Horror,Mystery","$9,000,000 (estimated)","$27,426,361","$48,046,804"
Free Guy,2021,PG-13,1h 55m,7.1,"When Guy, a bank teller, learns that he is a non-player character in a bloodthirsty, open-world video game, he goes on to become the hero of the story and takes the responsibility of saving ...","Action,Adventure,Comedy","$120,000,000 (estimated)","$121,626,598","$331,526,598"
Monkey Man,2024,R,2h 1m,7.1,An anonymous young man unleashes a campaign of vengeance against the corrupt leaders who murdered his mother and continue to systematically victimize the poor and powerless.,"Action,Thriller","$23,096,990","$10,119,435","$30,242,230"
Abigail,2024,R,1h 49m,7.1,"After a group of criminals kidnap the ballerina daughter of a powerful underworld figure, they retreat to an isolated mansion, unaware that they're locked inside with no normal little girl.","Horror,Thriller","$28,000,000 (estimated)","$15,027,755","$19,885,249"
Megan Leavey,2017,PG-13,1h 56m,7.1,Based on the true life story of a young Marine corporal whose unique discipline and bond with her military combat dog saved many lives during their deployment in Iraq.,"Action,Biography,Drama","$13,406,883","$3,810,867","$14,510,490"
Talk to Me,2022,R,1h 35m,7.1,"When a group of friends discover how to conjure spirits using an embalmed hand, they become hooked on the new thrill, until one of them goes too far and unleashes terrifying supernatural for...","Horror,Thriller","$4,500,000 (estimated)","$48,299,436","$92,181,735"
Three Thousand Years of Longing,2022,R,1h 48m,6.7,"A lonely scholar, on a trip to Istanbul, discovers a Djinn who offers her three wishes in exchange for his freedom.","Drama,Fantasy,Romance","$60,000,000 (estimated)","$8,286,741","$20,282,422"
Armageddon,1998,PG-13,2h 31m,6.7,"After discovering that an asteroid the size of Texas will impact Earth in less than a month, NASA recruits a misfit team of deep-core drillers to save the planet.","Action,Adventure,Sci-Fi","$140,000,000 (estimated)","$201,578,182","$553,712,773"
The Animal Kingdom,2023,,2h 8m,6.7,"An adventure between a father and his son, in a world where some humans have started mutating into other animal species.","Adventure,Drama,Horror","€13,000,000 (estimated)","$11,767","$8,938,787"
The Matrix Revolutions,2003,R,2h 9m,6.7,The human city of Zion defends itself against the massive invasion of the machines as Neo fights to end the war at another front while also opposing the rogue Agent Smith.,"Action,Sci-Fi","$150,000,000 (estimated)","$139,313,948","$427,344,325"
Commando,1985,R,1h 30m,6.7,"A retired Special Forces colonel tries to save his daughter, who was abducted by his former subordinate.","Action,Adventure,Thriller","$10,000,000 (estimated)","$35,100,000","$57,491,000"
Blast from the Past,1999,PG-13,1h 52m,6.7,A naive man comes out into the world after spending 35 years in a nuclear fallout shelter.,"Comedy,Drama,Romance","$35,000,000 (estimated)","$26,511,114","$40,263,020"
The Hill,2023,PG,2h 6m,6.7,The remarkable true-life story of Rickey Hill's improbable journey to play Major League Baseball.,"Biography,Drama,Sport","$7,665,865","$2,301,931","$7,697,028"
The Wolverine,2013,PG-13,2h 6m,6.7,"Wolverine comes to Japan to meet an old friend whose life he saved years ago, and gets embroiled in a conspiracy involving yakuza and mutants.","Action,Sci-Fi","$120,000,000 (estimated)","$132,556,852","$414,828,246"
Final Destination,2000,R,1h 38m,6.7,"After getting a premonition about a plane crash on his school trip, Alex, a student saves a few of his classmates. However, their situation gets complicated when death starts chasing them.","Horror,Thriller","$23,000,000 (estimated)","$53,331,147","$112,880,294"
Empire Records,1995,PG-13,1h 30m,6.7,Twenty-four hours in the lives of the young employees at Empire Records when they all grow up and become young adults thanks to each other and the manager. They all face the store joining a ...,"Comedy,Drama,Music","$273,188","$150,800","$273,188"
Black Panther: Wakanda Forever,2022,PG-13,2h 41m,6.7,The people of Wakanda fight to protect their home from intervening world powers as they mourn the death of King T'Challa.,"Action,Adventure,Drama","$250,000,000 (estimated)","$453,829,060","$859,208,836"
Riddle of Fire,2023,PG-13,1h 55m,6.7,Three mischievous children embark on a woodland odyssey when their mother sends them on an errand.,"Action,Adventure,Comedy","$54,671","$24,250","$58,950"
Robin Hood: Men in Tights,1993,PG-13,1h 44m,6.7,"A spoof of Robin Hood in general, and Robin Hood: Prince of Thieves (1991) in particular.","Adventure,Comedy,Musical","$20,000,000 (estimated)","$35,739,755","$35,739,755"
The Three Musketeers - Part I: D'Artagnan,2023,,2h 1m,6.7,"D'Artagnan arrives in Paris trying to find his attackers after being left for dead, which leads him to a real war where the future of France is at stake. He aligns himself with Athos, Portho...","Action,Adventure,History","€36,000,000 (estimated)","$31,843,086",
Love & Other Drugs,2010,R,1h 52m,6.7,"In 1990s Pittsburgh, a medicine peddler starts a relationship with a young woman suffering from Parkinson's disease.","Comedy,Drama,Romance","$30,000,000 (estimated)","$32,367,005","$102,820,008"
Suspiria,2018,R,2h 32m,6.7,"A darkness swirls at the center of a world-renowned dance company, one that will engulf the artistic director, an ambitious young dancer, and a grieving psychotherapist. Some will succumb to...","Drama,Fantasy,Horror","$20,000,000 (estimated)","$2,483,472","$7,942,093"
The Equalizer 2,2018,R,2h 1m,6.7,"Robert McCall serves an unflinching justice for the exploited and oppressed, but how far will he go when that is someone he loves?","Action,Crime,Thriller","$62,000,000 (estimated)","$102,084,362","$190,400,157"
You've Got Mail,1998,PG,1h 59m,6.7,"Book superstore magnate Joe Fox and independent book shop owner Kathleen Kelly fall in love in the anonymity of the Internet, both blissfully unaware that he's trying to put her out of busin...","Comedy,Drama,Romance","$65,000,000 (estimated)","$115,821,495","$250,821,575"
The New World,2005,PG-13,2h 15m,6.7,"The story of the English exploration of Virginia, and of the changing world and loves of Pocahontas.","Biography,Drama,History","$30,000,000 (estimated)","$12,712,093","$49,334,775"
Kingsman: The Golden Circle,2017,R,2h 21m,6.7,"After the Kingsman's headquarters is destroyed and the world is held hostage, an allied spy organization in the United States is discovered. These two elite secret agencies must band togethe...","Action,Adventure,Comedy","$104,000,000 (estimated)","$100,234,838","$410,902,662"
Purple Hearts,2022,TV-14,2h 2m,6.7,"In spite of their many differences, Cassie, a struggling singer-songwriter, and Luke, a troubled Marine, agree to marry solely for military benefits, but when tragedy strikes, the line betwe...","Drama,Music,Romance",,,
Emma.,2020,PG,2h 4m,6.7,"In 1800s England, a well meaning but selfish young woman meddles in the love lives of her friends.","Comedy,Drama,Romance","$10,000,000 (estimated)","$10,055,355","$26,404,660"
