title,release_year,parental_rating,movie_duration,movie_rating,description,genres,budget,gross_na,gross_worldwide
The Wedding Guest,2018,R,1h 36m,5.8,A story centered on a mysterious British Muslim man (Dev Patel) on his journey across Pakistan and India.,Thriller,"$5,000,000 (estimated)","$386,166","$386,166"
Noah,2014,PG-13,2h 18m,5.8,Noah is chosen by God to undertake a momentous mission before an apocalyptic flood cleanses the world.,"Action,Adventure,Drama","$125,000,000 (estimated)","$101,200,044","$359,200,044"
Pitch Perfect 3,2017,PG-13,1h 33m,5.8,"Following their win at the world championship, the now separated Bellas reunite for one last singing competition at an overseas USO tour, but face a group who uses both instruments and voice...","Comedy,Music","$45,000,000 (estimated)","$104,897,530","$185,400,345"
Oldboy,2013,R,1h 44m,5.8,"Obsessed with vengeance, a man sets out to find out why he was kidnapped and locked into solitary confinement for twenty years without reason.","Action,Drama,Mystery","$30,000,000 (estimated)","$2,193,658","$5,186,767"
2012,2009,PG-13,2h 38m,5.8,A frustrated writer struggles to keep his family alive when a series of global catastrophes threatens to annihilate mankind.,"Action,Adventure,Sci-Fi","$200,000,000 (estimated)","$166,112,167","$791,217,826"
Not Another Teen Movie,2001,R,1h 29m,5.8,A sendup of all the teen movies that have accumulated in the past two decades.,Comedy,"$15,000,000 (estimated)","$38,252,284","$66,468,985"
Old,2021,PG-13,1h 48m,5.8,"A vacationing family discovers that the secluded beach where they're relaxing for a few hours is somehow causing them to age rapidly, reducing their entire lives into a single day.","Drama,Horror,Mystery","$18,000,000 (estimated)","$48,276,510","$90,146,510"
Persuasion,2022,PG,1h 48m,5.8,"Eight years after Anne Elliot was persuaded not to marry a dashing man of humble origins, they meet again. Will she seize her second chance at true love?","Drama,Romance",,,
You'll Never Find Me,2023,,1h 40m,5.8,"Patrick, a strange and lonely resident, lives in a mobile home at the back of an isolated trailer park. After a violent storm, a mysterious young woman appears at his door seeking shelter fr...","Horror,Thriller","$18,591",,
Ghosted,2023,PG-13,1h 56m,5.8,"Cole falls head over heels for enigmatic Sadie, but then makes the shocking discovery that she's a secret agent. Before they can decide on a second date, Cole and Sadie are swept away on an ...","Action,Adventure,Comedy",,,
White Chicks,2004,PG-13,1h 49m,5.8,Two disgraced FBI agents go way undercover in an effort to protect hotel heiresses the Wilson sisters from a kidnapping plot.,"Comedy,Crime","$37,000,000 (estimated)","$70,831,760","$113,100,873"
Battleship,2012,PG-13,2h 11m,5.8,A fleet of ships is forced to do battle with an armada of unknown origins in order to discover and thwart their destructive goals.,"Action,Adventure,Sci-Fi","$209,000,000 (estimated)","$65,422,625","$303,025,485"
Fast X,2023,PG-13,2h 21m,5.8,Dom Toretto and his family are targeted by the vengeful son of drug kingpin Hernan Reyes.,"Action,Adventure,Crime","$340,000,000 (estimated)","$146,126,015","$704,875,015"
"Salò, or the 120 Days of Sodom",1975,TV-MA,1h 57m,5.8,"In World War II Italy, four fascist libertines round up nine adolescent boys and girls and subject them to 120 days of physical, mental, and sexual torture.",Drama,"$1,808,595",,
Cannibal Holocaust,1980,Unrated,1h 35m,5.8,"During a rescue mission into the Amazon rainforest, a professor stumbles across lost film shot by a missing documentary crew.","Adventure,Horror","$100,000 (estimated)",,
Cutthroat Island,1995,PG-13,2h 4m,5.7,A female pirate and her companion race against their rivals to find a hidden island that contains a fabulous treasure.,"Action,Adventure,Comedy","$98,000,000 (estimated)","$10,017,322","$10,017,322"
Nocturne,2020,Not Rated,1h 30m,5.7,An incredibly gifted pianist makes a Faustian bargain to overtake her older sister at a prestigious institution for classical musicians.,"Drama,Horror,Music",,,
Wildcat,2023,,1h 43m,5.7,Follows the life of writer Flannery O'Connor while she was struggling to publish her first novel.,"Biography,Drama",,,
Dennis the Menace,1993,PG,1h 34m,5.7,"When his parents must go out of town on business, Dennis stays with Mr. and Mrs. Wilson. He is driving Mr. Wilson crazy, but he is just trying to be helpful, even to the thief who has arrive...","Comedy,Family","$51,270,765","$9,331,139","$117,270,765"
The Blue Lagoon,1980,R,1h 44m,5.8,"In the Victorian period, two children are shipwrecked on a tropical island in the South Pacific. With no adults to guide them, the two make a simple life together, unaware that sexual maturi...","Adventure,Drama,Romance","$4,500,000 (estimated)","$58,853,106","$58,853,106"
Journey 2: The Mysterious Island,2012,PG,1h 34m,5.7,"Sean Anderson partners with his mom's husband on a mission to find his grandfather, who is thought to be missing on a mythical island.","Action,Adventure,Comedy","$79,000,000 (estimated)","$103,887,748","$335,288,576"
Memory,2022,R,1h 54m,5.7,An assassin-for-hire finds that he's become a target after he refuses to complete a job for a dangerous criminal organization.,"Action,Crime,Thriller","$30,000,000 (estimated)","$7,329,043","$13,897,255"
Deuce Bigalow: Male Gigolo,1999,R,1h 28m,5.7,"An average aquarium cleaner house-sits for a gigolo, only to be forced to become one himself.","Comedy,Romance","$17,000,000 (estimated)","$65,538,755","$92,938,755"
Murder Mystery 2,2023,PG-13,1h 30m,5.7,Full-time detectives Nick and Audrey are struggling to get their private eye agency off the ground. They find themselves at the center of international abduction when their friend Maharaja i...,"Action,Comedy,Crime",,,
Samaritan,2022,PG-13,1h 42m,5.7,A young boy learns that a superhero who was thought to have died after an epic battle twenty-five years ago may in fact still be alive.,"Action,Drama,Fantasy","$100,000,000 (estimated)",,
The Three Musketeers,2011,PG-13,1h 50m,5.7,The hot-headed young D'Artagnan along with three former legendary but now down-on-their-luck Musketeers must unite and defeat a beautiful double agent and her villainous employer from seizin...,"Action,Adventure,Fantasy","$75,000,000 (estimated)","$20,374,484","$132,274,484"
The Tiger's Apprentice,2024,PG,1h 24m,5.7,"Tom Lee, a Chinese-American boy, after the death of his grandmother, has to be apprenticed to the talking tiger Mr. Hu and learn ancient magic to become the new guardian of an ancient phoeni...","Animation,Action,Adventure","$564,252",,
101 Dalmatians,1996,G,1h 43m,5.7,An evil high-fashion designer plots to steal dalmatian puppies in order to make an extravagant fur coat but creates an extravagant mess instead.,"Adventure,Comedy,Crime","$75,000,000 (estimated)","$136,189,294","$320,689,294"
The Wrong Missy,2020,TV-MA,1h 30m,5.7,"Tim thinks he's invited the woman of his dreams on a work retreat to Hawaii, realizing too late he mistakenly texted someone from a nightmare blind date.","Comedy,Romance",,,
What to Expect When You're Expecting,2012,PG-13,1h 50m,5.7,"Follows the lives of five interconnected couples as they experience the thrills and surprises of having a baby and realize that no matter what you plan for, life does not always deliver what...","Comedy,Drama,Romance","$40,000,000 (estimated)","$41,152,203","$84,384,002"
Your Place or Mine,2023,PG-13,1h 49m,5.7,Two long-distance best friends change each other's lives when she decides to pursue a lifelong dream and he volunteers to keep an eye on her teenage son.,"Comedy,Romance",,,
Fantastic Four,2005,PG-13,1h 46m,5.7,"A group of astronauts gain superpowers after a cosmic radiation exposure and must use them to oppose the plans of their enemy, Doctor Victor Von Doom.","Action,Adventure,Fantasy","$100,000,000 (estimated)","$154,696,080","$333,535,934"
John Tucker Must Die,2006,PG-13,1h 29m,5.7,Three ex-girlfriends of a serial cheater set up their former lover to fall for the new girl in town so they can watch him get his heart broken.,"Comedy,Romance","$18,000,000 (estimated)","$41,011,711","$68,844,775"
Buffy the Vampire Slayer,1992,PG-13,1h 26m,5.7,Flighty teenage girl Buffy Summers learns that she is her generation's destined battler of vampires.,"Action,Comedy,Fantasy","$7,000,000 (estimated)","$16,624,456","$16,625,256"
G.I. Joe: The Rise of Cobra,2009,PG-13,1h 58m,5.7,"An elite military unit comprised of special operatives known as G.I. Joe, operating out of The Pit, takes on an evil organization led by a notorious arms dealer.","Action,Adventure,Sci-Fi","$175,000,000 (estimated)","$150,201,498","$302,469,017"
The Purge,2013,R,1h 25m,5.7,"A wealthy family is held hostage for harboring the target of a murderous syndicate during the Purge, a 12-hour period in which any and all crime is legal.","Horror,Sci-Fi,Thriller","$3,000,000 (estimated)","$64,473,115","$89,328,627"
Allegiant,2016,PG-13,2h,5.7,"After the earth-shattering revelations of Insurgent, Tris must escape with Four beyond the wall that encircles Chicago, to finally discover the shocking truth of the world around them.","Action,Adventure,Mystery","$110,000,000 (estimated)","$66,184,051","$179,246,868"
Mechanic: Resurrection,2016,R,1h 38m,5.7,Bishop's most formidable foe kidnaps the love of his life in order to make him complete three impossible assassinations and make them look like accidents.,"Action,Adventure,Crime","$40,000,000 (estimated)","$21,218,403","$125,729,635"
Coyote Ugly,2000,PG-13,1h 40m,5.7,"Aspiring songwriter Violet Sanford, after getting a job at a women-run NYC bar that teases its male patrons, comes out of her shell.","Comedy,Drama,Music","$45,000,000 (estimated)","$60,786,269","$113,916,474"
Beethoven,1992,PG,1h 27m,5.7,"A slobbering St. Bernard becomes the center of attention for a loving family, but must contend with a dog-napping veterinarian and his henchmen.","Comedy,Drama,Family","$57,114,049","$7,587,565","$147,214,049"
Pet Sematary,2019,R,1h 40m,5.7,"Dr. Louis Creed and his wife, Rachel, relocate from Boston to rural Maine with their two young children. The couple soon discover a mysterious burial ground hidden deep in the woods near the...","Horror,Mystery,Thriller","$21,000,000 (estimated)","$54,724,696","$113,118,226"
Alien vs. Predator,2004,PG-13,1h 41m,5.7,"During an archaeological expedition on Bouvetøya Island in Antarctica, a team of archaeologists and other scientists find themselves caught up in a battle between the two legends. Soon, the ...","Action,Adventure,Horror","$60,000,000 (estimated)","$80,282,231","$177,427,090"
Sister Act 2: Back in the Habit,1993,PG,1h 47m,5.7,Showgirl Deloris Van Cartier returns as Sister Mary Clarence to teach music to a group of Catholic students whose run-down school is slated for closure.,"Comedy,Family,Music","$38,000,000 (estimated)","$57,319,029","$57,319,029"
Freddy vs. Jason,2003,R,1h 37m,5.7,"Freddy Krueger and Jason Voorhees return to terrorize the teenagers of Elm Street. Only this time, they're out to get each other, too.","Action,Horror","$30,000,000 (estimated)","$82,633,448","$116,643,421"
Heart of Stone,2023,PG-13,2h 2m,5.7,An intelligence operative for a shadowy global peacekeeping agency races to stop a hacker from stealing its most valuable and dangerous weapon.,"Action,Crime,Thriller",,,
The Midnight Sky,2020,PG-13,1h 58m,5.7,"This post-apocalyptic tale follows Augustine, a lonely scientist in the Arctic, as he races to stop Sully and her fellow astronauts from returning home to a mysterious global catastrophe.","Adventure,Drama,Sci-Fi","$70,018",,
Last Seen Alive,2022,R,1h 35m,5.7,Will's soon-to-be ex-wife mysteriously vanishes at a gas station. He delves into the town's criminal underbelly while running from the authorities in a race against time to find her.,"Action,Adventure,Crime","$5,950,199",,
Players,2024,TV-MA,1h 45m,5.7,"A sports writer unused to relationships falls for a fling, leading her to reconsider playing the field in favor of commitment.","Comedy,Romance",,,
Security,2017,R,1h 28m,5.7,A security guard protects an eleven year-old girl who is being targeted by a gang for participating as a trial witness.,"Action,Crime,Thriller","$15,000,000 (estimated)","$776,522",
The Nightmare,2015,Not Rated,1h 31m,5.7,A look at a frightening condition that plagues thousands; sleep paralysis.,"Documentary,Horror","$28,281","$13,363","$41,853"
Bad Teacher,2011,R,1h 32m,5.7,"A lazy, incompetent middle school teacher who hates her job, her students, and her co-workers is forced to return to teaching to make enough money for breast implants after her wealthy fianc...","Comedy,Romance","$20,000,000 (estimated)","$100,292,856","$216,197,492"
Dark Phoenix,2019,PG-13,1h 53m,5.7,"Jean Grey begins to develop incredible powers that corrupt and turn her into a Dark Phoenix, causing the X-Men to have to decide if her life is worth more than all of humanity.","Action,Adventure,Sci-Fi","$200,000,000 (estimated)","$65,845,974","$252,442,974"
Sex and the City,2008,R,2h 25m,5.7,A New York City writer on sex and love is finally getting married to her Mr. Big. But her three best girlfriends must console her after one of them inadvertently leads Mr. Big to jilt her.,"Comedy,Drama,Romance","$65,000,000 (estimated)","$152,647,258","$418,769,972"
Cuckoo,2024,R,1h 42m,5.7,A 17-year old girl is forced to move with her family to a resort where things are not what they seem.,"Horror,Mystery,Thriller",,,
Cry Macho,2021,PG-13,1h 44m,5.7,"A one-time rodeo star and washed-up horse breeder takes a job to bring a man's young son home and away from his alcoholic mom. On their journey, the horseman finds redemption through teachin...",Drama,"$33,000,000 (estimated)","$10,310,734","$16,510,734"
Ruby Gillman: Teenage Kraken,2023,PG,1h 31m,5.7,"A shy adolescent learns that she comes from a fabled royal family of legendary sea krakens and that her destiny lies in the depths of the waters, which is bigger than she could have ever ima...","Animation,Action,Comedy","$70,000,000 (estimated)","$15,753,600","$45,528,749"
The Meg,2018,PG-13,1h 53m,5.7,A group of scientists exploring the Marianas Trench encounter the largest marine predator that has ever existed - the Megalodon.,"Action,Horror,Sci-Fi","$130,000,000 (estimated)","$145,522,784","$529,338,515"
The Matrix Resurrections,2021,R,2h 28m,5.7,"Return to a world of two realities: one, everyday life; the other, what lies behind it. To find out if his reality is a construct, to truly know himself, Mr. Anderson will have to choose to ...","Action,Sci-Fi","$190,000,000 (estimated)","$37,686,805","$157,386,805"
Spaceman,2024,R,1h 47m,5.7,"Half a year into his solo mission on the edge of the solar system, an astronaut concerned with the state of his life back on Earth is helped by an ancient creature he discovers in the bowels...","Adventure,Drama,Sci-Fi","$40,000,000 (estimated)",,
Code 8: Part II,2024,TV-MA,1h 40m,5.7,"Follows a girl fighting to get justice for her slain brother by corrupt police officers. She enlists the help of an ex-con and his former partner, they face a highly regarded and well protec...","Action,Crime,Drama",,,
Argylle,2024,PG-13,2h 19m,5.7,"A reclusive author who writes espionage novels about a secret agent and a global spy syndicate realizes the plot of the new book she's writing starts to mirror real-world events, in real tim...","Action,Comedy,Thriller","$200,000,000 (estimated)","$45,207,275","$96,170,413"
Mean Girls,2024,PG-13,1h 52m,5.7,"Cady Heron is a hit with the Plastics, an A-list girl clique at her new school. But everything changes when she makes the mistake of falling for Aaron Samuels, the ex-boyfriend of alpha Plas...","Comedy,Musical","$36,000,000 (estimated)","$72,404,248","$104,404,248"
Me Time,2022,R,1h 41m,5.1,"When a stay-at-home dad who dedicates all his time to his children is persuaded to take time off for himself, he gets mixed up in the wild shenanigans of his childhood friend who's celebrati...",Comedy,"$80,000,000 (estimated)",,
Planet of the Apes,2001,PG-13,2h,5.7,"In 2029, an Air Force astronaut crash-lands on a mysterious planet where evolved, talking apes dominate a race of primitive humans.","Action,Adventure,Sci-Fi","$100,000,000 (estimated)","$180,011,740","$362,211,740"
Candy,1968,R,1h 55m,5.1,"Candy Christian, an innocent high-schooler, encounters numerous colorful characters and humorous sexual situations while attempting to find meaning in life.","Adventure,Comedy,Fantasy","$3,000,000 (estimated)",,
The Unholy,2021,PG-13,1h 39m,5.1,"A hearing-impaired girl is visited by the Virgin Mary and can suddenly hear, speak, and heal the sick. As people flock to witness her miracles, terrifying events unfold. Are they the work of...","Drama,Horror,Mystery","$15,532,137","$3,153,456","$30,832,137"
Private Lessons,1981,R,1h 27m,5.1,An immigrant housemaid seduces a 15-year-old boy and later fakes her own death as part of his chauffeur's blackmail plot. Troubles arise when the two start to fall in love.,Comedy,"$2,800,000 (estimated)","$26,279,000","$26,279,000"
10x10,2018,,1h 28m,5.1,"A man abducts a flower shop owner and holds her captive in a small, soundproof room in an effort to extract a dark secret from her past.","Drama,Mystery,Thriller","$2,263","$1,430","$68,260"
The Hills Have Eyes 2,2007,R,1h 29m,5.1,A group of National Guard trainees find themselves battling against a vicious group of mutants on their last day of training in the desert.,"Horror,Thriller","$15,000,000 (estimated)","$20,804,166","$37,697,773"
Eaten Alive!,1980,Not Rated,1h 32m,5.1,A young woman teams up with a mercenary to find her missing sister in the jungles of New Guinea where they find that a deranged leader of a religious cult has located his commune in an area ...,"Adventure,Horror",,,
The Phantom,1996,PG,1h 40m,5.1,"The Phantom, descendent of a line of African superheroes, travels to New York City to thwart a wealthy criminal genius from obtaining three magic skulls which would give him the secret to ul...","Action,Adventure,Comedy","$45,000,000 (estimated)","$17,323,326","$17,323,326"
White Men Can't Jump,2023,R,1h 41m,5.1,A remake of the 1992 film about a pair of basketball hustlers who team up to earn extra cash.,"Comedy,Drama,Sport",,,
An American Werewolf in Paris,1997,R,1h 38m,5.1,An American man unwittingly gets involved with French werewolves who have developed a serum allowing them to transform at will.,"Comedy,Fantasy,Horror","$25,000,000 (estimated)","$26,570,463","$26,570,463"
"10,000 BC",2008,PG-13,1h 49m,5.1,"In the prehistoric past, D'Leh is a mammoth hunter who bonds with the beautiful Evolet. When warriors on horseback capture Evolet and the tribesmen, D'Leh must embark on an odyssey to save h...","Action,Adventure,Drama","$105,000,000 (estimated)","$94,784,201","$269,784,201"
The King's Daughter,2022,PG,1h 38m,5.1,"King Louis XIV's quest for immortality leads him to capture and steal a mermaid's life force, a move that is further complicated by his illegitimate daughter's discovery of the creature.","Action,Adventure,Family","$40,500,000 (estimated)","$1,758,963","$2,231,447"
Cannibal Ferox,1981,,1h 33m,5.1,"Three friends set out to disprove cannibalism on a trip to the Amazonian jungle, where they meet two men trying to escape a vicious cannibal tribe.","Adventure,Horror",,,
Even Lambs Have Teeth,2015,Unrated,1h 19m,5.1,Two young women terrorized by a group of small town psychos seek revenge on their tormentors.,"Horror,Thriller",,,
Conan the Barbarian,2011,R,1h 53m,5.1,A vengeful barbarian warrior sets off to get his revenge on the evil warlord who attacked his village and murdered his father when he was a boy.,"Action,Adventure,Fantasy","$90,000,000 (estimated)","$21,295,021","$63,523,283"
Lord of Misrule,2023,,1h 44m,5.1,A desperate search for the young daughter of the town's new minister.,Horror,"$3,717","$2,662","$980,644"
Stormbreaker,2006,PG,1h 33m,5.1,"After the death of his uncle, the 14-year-old schoolboy Alex Rider is forced by the Special Operations Division of the UK's secret intelligence service, MI6, into a mission which will save m...","Action,Adventure,Family","£40,000,000 (estimated)","$677,646","$23,937,870"
A Dirty Shame,2004,NC-17,1h 29m,5.1,"An uptight, middle-aged, repressed woman turns into a sex addict after getting hit on the head, and she then falls into an underground subculture of sex addicts in suburban Baltimore.",Comedy,"$15,000,000 (estimated)","$1,339,668","$1,914,166"
The VelociPastor,2018,Not Rated,1h 15m,5.1,"After losing his parents, a priest travels to China, where he inherits a mysterious ability that allows him to turn into a dinosaur. At first horrified by this new power, a hooker convinces ...","Action,Adventure,Comedy","$11,000 (estimated)",,
Sex Tape,2014,R,1h 34m,5.1,"A married couple wake up to discover that the sex tape they made the evening before has gone missing, leading to a frantic search for its whereabouts.","Comedy,Romance","$40,000,000 (estimated)","$38,543,473","$126,069,509"
Now & Later,2011,Unrated,1h 39m,5.1,"Angela an illegal immigrant living in Los Angeles stumbles across Bill, a disgraced banker on the run.Through sex, conversation ranging from politics to philosophy, and other worldly pleasur...",Drama,"$1,808","$1,516","$1,808"
Through My Window: Across the Sea,2023,TV-MA,1h 49m,5.1,"Ares and Raquel maintain a long-distance relationship during his studies in Stockholm. When they meet again, they find that their period of separation has put their love to the test.","Comedy,Drama,Romance",,,
Clementine,2019,Not Rated,1h 30m,5.1,"Reeling from a one-sided breakup, heartbroken Karen breaks into her ex's lake house. There, she strikes up a complicated relationship with provocative younger woman Lana.",Drama,,,
5lbs of Pressure,2024,R,1h 51m,5.2,"Trying to start over, Adam searches for redemption as he returns to his old neighborhood to put to rest his demons while the brother of the man he killed seeks revenge.","Crime,Romance,Thriller",,,
How It Ends,2018,TV-MA,1h 53m,5.1,"In the midst of an apocalypse, a man struggles to reach his pregnant fiancé, who is thousands of miles away.","Action,Drama,Horror","$20,000,000 (estimated)",,
Sliver,1993,R,1h 47m,5.1,A woman moves into an exclusive New York City apartment building that she soon discovers houses tenants with all manner of shocking secrets.,"Drama,Thriller","$40,000,000 (estimated)","$36,300,000","$116,300,000"
The Final Destination,2009,R,1h 22m,5.1,A horrifying premonition saves a young man and his friends from death during a racetrack accident but terrible fates await them nonetheless.,"Horror,Thriller","$40,000,000 (estimated)","$66,477,700","$186,167,139"
Red Sonja,1985,PG-13,1h 29m,5.1,The fearless warrior Red Sonja sets out to avenge her family's murder and rid her kingdom from the tyrannical rule of evil Queen Gedren.,"Action,Adventure,Fantasy","$17,900,000 (estimated)","$6,948,633","$6,951,415"
Locked In,2023,TV-MA,1h 36m,5.1,"A kindly nurse tries to unlock the secrets of a coma patient's injury - and discovers the bitter rivalry, infidelity, betrayal and murder behind them.","Drama,Mystery,Thriller",,,
The NeverEnding Story II: The Next Chapter,1990,PG,1h 29m,5.1,A young boy with a distant father enters a world of make-believe and magic through a portal within an antique book.,"Adventure,Drama,Family","$36,000,000 (estimated)","$17,373,527","$17,373,527"
Frivolous Lola,1998,Not Rated,1h 45m,5.1,"Set in the 1950s Italian countryside, the film tells the story of Lola and Masetto, a young couple whose views on premarital sex differ drastically.","Comedy,Romance",,,
Eragon,2006,PG,1h 44m,5.1,"In his homeland of Alagaesia, a farm boy happens upon a dragon's egg -- a discovery that leads him on a predestined journey where he realizes he's the one person who can defend his home agai...","Action,Adventure,Family","$100,000,000 (estimated)","$75,030,163","$250,425,512"
First Daughter,2004,PG,1h 46m,5.1,The daughter of the U.S. President heads off to college where she falls for a graduate student with a secret.,"Comedy,Drama,Romance","$30,000,000 (estimated)","$9,055,921","$10,592,180"
Acid,2023,,1h 39m,5.1,"In the middle of a heat wave, an ominous cloud appears and with it, a lethal acid rain. A separated family will have to come together to escape this plague ravaging the world.","Drama,Sci-Fi","$2,464,369",,
Scary Movie 4,2006,PG-13,1h 23m,5.1,"Cindy finds out the house she lives in is haunted by a little boy and goes on a quest to find out who killed him and why. Also, Alien ""Tr-iPods"" are invading the world and she has to uncover...",Comedy,"$45,000,000 (estimated)","$90,710,620","$178,262,620"
The Haunted Hotel,2023,TV-MA,1h 50m,5.1,"Raina's life was threatened after she opened the door and entered an unnumbered room in the hotel managed by her sister, Fey. The figure of a woman with white hair and skin also made her pre...","Horror,Thriller",,,
Pinocchio,2022,PG,1h 45m,5.1,"A puppet is brought to life by a fairy, who assigns him to lead a virtuous life in order to become a real boy.","Adventure,Comedy,Drama","$150,000,000 (estimated)","$33,731",
The Twilight Saga: Eclipse,2010,PG-13,2h 4m,5.1,"As a string of mysterious killings grips Seattle, Bella, whose high school graduation is fast approaching, is forced to choose between her love for vampire Edward and her friendship with wer...","Action,Adventure,Drama","$68,000,000 (estimated)","$300,531,751","$698,513,085"
Nothing But Trouble,1991,PG-13,1h 34m,5.1,A businessman and his friends are captured by a sadistic judge and his equally odd family in a bizarre mansion in the backwoods.,Comedy,"$40,000,000 (estimated)","$8,479,793","$8,479,793"
