title,release_year,parental_rating,movie_duration,movie_rating,description,genres,budget,gross_na,gross_worldwide
Desierto Verde,2014,,1h 26m,1.2,"In a small town in Argentina surrounded by soy fields, hundreds of people are dying of cancer poisoned by pesticides. For the very first time, an unprecedented trial opened.","Documentary,Biography,History",,,
Fuego en el Pozo,2018,,48m,1.2,,Documentary,€300 (estimated),,
Homesick,2013,,1h 38m,1.2,,Drama,,,
Ggamdong,1988,,1h 58m,1.2,,,,,
Waterproof,2018,,1h 13m,1.2,"Jack is in a rut and unsure what to do with his life. He tries to stay focused and get his life in order, but all manner of distractions get in the way.","Comedy,Romance","£1,500 (estimated)",,
The Oath of Tobruk,2012,,1h 40m,1.2,A documentary about the fall of Moammar Gaddafi.,Documentary,,,
Death World,2018,,48m,1.2,"""Death World"" is a zombie anthology film of 3 stories. ""The Fittest"" is about college students surviving, ""Lifeline"" takes place in a zip-lane park, and ""Reflex Action"" is about a security g...",Horror,$521 (estimated),,
Türk Lokumu,2016,,1h 32m,1.2,,Comedy,"$7,870",,
Sevimli Emojiler 2,2018,,1h 20m,1.2,,Animation,,,
The Secret of Flag Results,1977,,45m,1.2,,,,,
Heist,2019,,1h 32m,1.2,,"Action,Drama",,,
Yûyami Daria,2011,,1h 10m,1.2,,Comedy,,,
Olaf,2022,,1h 31m,1.2,,Comedy,,,
The Time Machine (I Found at a Yardsale),2011,,1h 24m,1.2,"Robert Moore [Johnny James Gatyas] buys a box at a yard sale that turns out to be a time machine. He travels to the future and rescues a slave named She-Ba [Amy Henry]. Together, they go on ...",Sci-Fi,"$3,500 (estimated)",,
Mantikora,2011,,1h 50m,1.2,"Katya, a highly-skilled racing-car driver, is forced to play in a deadly game where mysterious creatures are killing other racers.","Action,Crime,Drama","$1,666,597",,
Status,2023,,1h 2m,1.2,"A young man from the provinces, in search of a better life, comes to Moscow and falls in love with the girlfriend of a wealthy businessman who does not approve of this union. A friend of a v...","Crime,Drama","RUR 32,000,000 (estimated)",,
The Maize 2: Forever Yours,2006,,1h 48m,1.2,"After retrieving his two children from The Maize and putting down a killer to rest, Walker, the benevolent, finds himself struggling between three lovers and their dementia.","Horror,Mystery",,,
Extraction Point,2021,,1h 12m,1.2,"When a UFO is taken down by the government making it crash, Nemon (Farid Jamal Khan) is taken to a secret Laboratory ran by Dr. Silva (Joe Bei) for anything and everything evil. Becoming clo...","Action,Sci-Fi",,,
"Kidnapping, Caucasian Style",2014,,1h 35m,1.2,"Journalist Shurik comes to the Caucasus to film a report about the local beauty and tradition, and into the Gorski, fiefdom of the local city mayor George Gadzhievich Saakhov. Those supporti...",Comedy,"$3,500,000 (estimated)","$291,766",
Frankenpimp,2009,,3h 14m,1.2,"Romeo Montague is the alias of (the re-animated) Patient Zero, a skilled, mutated android hit-man/pimp/ancient relics collector, that lives in Verona City, N.Y.; a dystopic metropolis filled...","Action,Comedy,Fantasy","CA$30,000 (estimated)",,
15/07: Break of Dawn,2021,,1h 35m,1.2,"Dramatisation based on real events, brings together different people during an attempted coup on the Bosphorus Bridge in Istanbul in 2016.","Action,Drama,War","$243,208",,
Bible Town,2017,,1h 20m,1.2,Three friends travel to a place where all of the inhabitants tell inspirational Bible stories.,Animation,,,
Müjde,2022,,48m,1.2,"After losing her home and all that she's known, a widowed Turkish woman finds herself in an unexpected love affair with a young Syrian refugee in Istanbul.",Drama,"€60,000 (estimated)",,
Kurz,2023,,1h 28m,1.2,"Few personalities have shaped the political landscape in Austria in such a short time, polarized discussions and emotionalized people. Celebrated, criticized, admired, demonized. A portrait ...","Documentary,Crime",,,
Kiara the Brave,2011,PG,1h 30m,1.2,King Maximus's Dreamzone empire is threatened by his brother Badmess and Dr. Ozox.,"Animation,Family,Fantasy",,,
Our Drawings,2023,TV-MA,1h 1m,1.2,"Paige Foster, discovers a mysterious intruder inside her artwork where she travels. Her beatboxing puppy sidekick helps search within her imaginative realms drawings that enable Foster to be...","Animation,Adventure",,,
Smolensk,2016,,2h,1.2,"An inspired story of people affected by the 2010 crash of Polish Air Force Flight 101 in Smolensk, Russia. Fiery reporter Nina won't accept the story she's been given and is determined to fi...","Drama,Thriller","$3,000,000 (estimated)","$2,336,032",
Cumali Ceber 2,2018,,1h 40m,1.2,Cumali Ceber learns about the demolition of the nursing home in the neighborhood belonging to his grandfather while he is in the process of asking his eldest son Cevher for a girl and gives ...,Comedy,"TRL 1,500,000 (estimated)","$445,125",
Desh Drohi,2008,Not Rated,2h 20m,1.2,"Raja arrives in Mumbai looking for a job but ends up killing the brother of a local drug dealer. Realising the corrupt nature of politics, he goes on a killing spree and kills ten people in ...","Action,Thriller","$121,253",,
Greyhound Attack,2019,,1h 20m,1.2,US Air Force fighter pilots are sent on a dangerous mission to destroy a German airbase.,"Action,Drama,War","$1,500,000 (estimated)",,
Rollergator,1996,Not Rated,1h 23m,1.2,"A teen-age girl tries to help a small, purple, jive-talking alligator escape the clutches of a greedy carnival owner as well as as an assortment of characters so he can be reunited with his ...",Family,,,
Greyhound Attack,2019,,1h 20m,1.2,US Air Force fighter pilots are sent on a dangerous mission to destroy a German airbase.,"Action,Drama,War","$1,500,000 (estimated)",,
Desh Drohi,2008,Not Rated,2h 20m,1.2,"Raja arrives in Mumbai looking for a job but ends up killing the brother of a local drug dealer. Realising the corrupt nature of politics, he goes on a killing spree and kills ten people in ...","Action,Thriller","$121,253",,
Rollergator,1996,Not Rated,1h 23m,1.2,"A teen-age girl tries to help a small, purple, jive-talking alligator escape the clutches of a greedy carnival owner as well as as an assortment of characters so he can be reunited with his ...",Family,,,
Smolensk,2016,,2h,1.2,"An inspired story of people affected by the 2010 crash of Polish Air Force Flight 101 in Smolensk, Russia. Fiery reporter Nina won't accept the story she's been given and is determined to fi...","Drama,Thriller","$3,000,000 (estimated)","$2,336,032",
Sadak 2,2020,TV-MA,2h 13m,1.2,"The film picks up where Sadak left off, revolving around the journey with a young girl who becomes an important character in the life of the protagonist, and the reason for him to stay alive...","Action,Drama","$2,073",,
Finding Jesus,2020,Not Rated,1h 9m,1.2,"Two friends, Muggles and Joy, spread faith and hope in a number of isolated encounters which reinforce basic biblical values.","Animation,Family,Fantasy",,,
Sadak 2,2020,TV-MA,2h 13m,1.2,"The film picks up where Sadak left off, revolving around the journey with a young girl who becomes an important character in the life of the protagonist, and the reason for him to stay alive...","Action,Drama","$2,073",,
Daniel the Wizard,2004,Not Rated,1h 21m,1.2,"Evil assassins want to kill Daniel Kublbock, the third runner up for the German Idols.","Comedy,Crime,Fantasy",,,
Finding Jesus,2020,Not Rated,1h 9m,1.2,"Two friends, Muggles and Joy, spread faith and hope in a number of isolated encounters which reinforce basic biblical values.","Animation,Family,Fantasy",,,
Daniel the Wizard,2004,Not Rated,1h 21m,1.2,"Evil assassins want to kill Daniel Kublbock, the third runner up for the German Idols.","Comedy,Crime,Fantasy",,,
Potroshitel iz prigoroda,2016,,46m,1.1,,"Horror,Thriller",,,
Chains of Mephistopheles 2,2017,,1h 21m,1.1,,"Horror,Thriller",$10 (estimated),,
Maudit soit l'exil,2003,,49m,1.1,,Documentary,,,
Ritoru Kyouta no bouken,2017,,1h 22m,1.1,,Adventure,,,
Mstitel chelovechestva,2016,,1h 6m,1.1,,"Action,Horror,Thriller",,,
Girl in the Case,1935,,1h,1.1,,"Adventure,Comedy",,,
Prigorodskiy potroshitel 6. Naslediye,2016,,51m,1.1,,"Horror,Thriller",,,
"Ich denk', mich tritt ein Pferd",1975,,1h 31m,1.1,,,,,
Trilogy of Bloody Guts,2015,,1h,1.1,"Three shorts: serial killer, cannibal and zombie outbreak caused by mad scientist's experiments. Will the youths survive the zombies?",Horror,,,
Byagaj,2019,,1h 37m,1.1,"To run away from your home, because your brother stole the money you collect to buy a camera. To let in your car the first person with trouble on the road, to kiss his girlfriend and to find...",Adventure,,,
Justin Bieber: Always Believing,2012,Not Rated,1h 10m,1.1,"Go beyond the music to learn what it took for Justin Bieber, a boy from small town with a passion for music, to dominate the pop charts around the world.","Documentary,Music",,,
Sarkooft,2018,,1h 32m,1.1,,Family,"IRR 200,000,000 (estimated)",,
A Moment of Youth,2011,Not Rated,2h 23m,1.1,A moment of youth is a short film compilation that showcases nine up-and-coming directors from seven countries in five continents.,"Adventure,Biography,Comedy",,,
Heroj ulice,2023,,1h 30m,1.1,,Drama,"€300,000 (estimated)",,
Harry & Meghan: A New Life in Hollywood,2022,,56m,1.1,Two people with troubled relationships with their families talk about themselves.,Documentary,"£100,000 (estimated)",,
Parentesi tonde,2006,,1h 35m,1.1,"Vanessa, a runaway bride, and Emanuela became friends on the ferry to a tourist resort. Together they will take part of the chaotic life of the resort.",Comedy,,,
A Cosmic Adventure on Earth,2002,,1h 20m,1.1,"Aliens from Planet X with genetic problems decide to find an Earth stud, who will have intercourse with a representative of their race, beget offspring and prevent the destruction of their s...",Comedy,,,
Sensual Psychedelia,2019,,1h 29m,1.1,Three women on their way to a rave encounter a strange sight in the night sky: a spaceship full of shimmering celestial beings abducting Earthlings! This psychedelic ballet is packed with ha...,"Fantasy,Sci-Fi",,,
Elment az öszöd,2013,,1h 17m,1.1,"The film deals with the important events of 2006, presenting the background as well. Spring parliamentary elections, autumn speech and publicity, MTV siege, October 23rd at the Astoria. The ...",Drama,"HUF 5,000,000 (estimated)",,
Browncoats: Independence War,2015,,1h 38m,1.1,"A group of soldiers, on the last day of a War, set out to rescue a band of refugees who are trapped in a valley, before an enemy offensive wipes them out.","Action,Sci-Fi,War",,,
Selfie,2018,,1h 20m,1.1,,"Biography,Drama",,,
To Crack Bloggers,2016,,1h 7m,1.1,Popular teen video-bloggers became digital persons after being «hacked» by evil computer virus. They need to find their way back home from this «digital trap».,"Animation,Comedy,Family","RUR 35,000,000 (estimated)","$120,507",
Proud American,2008,PG,1h 55m,1.1,A lot things go down in the old town. When a white supremacy group comes by.,Drama,"$131,357","$135,000","$131,357"
Badang,2018,,1h 45m,1.1,A male college student is often bullied by friends because of his gentle nature but actually has extraordinary power. His mother died due to being hit by a criminals who came to ask money fo...,"Action,Adventure,Comedy","MYR 2,200,000 (estimated)",,
Kids Against the Sorcerers,2016,,1h 28m,1.1,"Magic is slowly corrupting the world. In order to save Russia from the same fate, Ivan Tsaritsin with some help from his friends, will try to put an end to this.","Animation,Adventure,Drama","$3,000,000 (estimated)",,
Vixen Highway 2006: It Came from Uranus!,2010,,4h 10m,1.1,Rock-star Bobby Barzell awaits a liver transplant from a psychotic fugitive of the law: as a vengeful blood demon-alien tries to collect on for a past debt.,"Action,Horror,Thriller","CA$35,000 (estimated)",,
The Crimean Bridge. Made with Love!,2018,,1h 42m,1.1,"A hot summer and a gentle sea. Crimean Bridge (Crimea) is being built in Kerch. Dima, a young and daring builder, has a hobby: from every change of female students-archeologists choose the m...",Romance,"RUR 300,000,000 (estimated)","$1,024,299",
The Autobots,2015,Not Rated,1h 25m,1.1,"Three cars with sentient artificial intelligence for the ultimate interaction with humans. In a world where people normally drive cars, three plucky cars will go on an adventure and find tha...","Animation,Adventure,Family",,,
Troy: The Resurrection of Aeneas,2018,,1h,1.1,The Journey of Aeneas after the Trojan War. Based on the epic poems of the Aeneid by Publius Vergilius Maro.,"Animation,Action,Adventure",,,
Jurassic Hunt,2021,R,1h 24m,2.5,"Female adventurer Parker joins a crew of male trophy hunters in a remote wilderness park. Their goal: slaughter genetically recreated dinosaurs for sport using rifles, arrows, and grenades.","Action,Adventure,Sci-Fi",,,
Breakdown Lane,2017,,1h 16m,2.8,"When Kirby Lane's SUV breaks down in the middle of the desert, she must overcome the dehydration, coyotes, and lurking undead to find her way home.","Action,Drama,Horror",,,
Meteor,2021,TV-14,1h 24m,3.0,"After a meteor collides into Earth, a lonely rancher and a lost young girl are on the run from vicious mercenaries.","Drama,Sci-Fi,Thriller","$20,000 (estimated)",,
The Haunting of Margam Castle,2020,TV-14,1h 21m,2.5,"A team of American parapsychologists travel to Wales to conduct a study of Margam Castle, one of the UK's most haunted buildings.","Drama,Horror,Mystery",,,
Six Hot Chicks in a Warehouse,2017,,1h 33m,2.8,"A body conscious photographer, Adrian, concocts a scenario in which he attempts to project his insecurities onto those who mock him. Hired by Adrian, his professed muse Mira and five other g...","Action,Comedy,Horror","$90,000 (estimated)",,
Jism 2,2012,,2h 10m,3.1,"Izna, a porn star, is tasked by an Indian Intelligence Agency to seduce her ex-boyfriend Kabir, a dreaded assassin, in order to steal vital information relating to his sleeper cell contacts.","Drama,Romance,Thriller","$47,109",,
Snowbound,2017,,1h 33m,3.2,"A group of erotic party attendees wake up naked in the snow. In the nearby cabin they find a dead girl and a message: In order to survive, they must decide who is responsible for the girl's ...","Horror,Mystery",,,
Return of the Living Dead: Rave to the Grave,2005,R,1h 26m,3.3,"A college student creates a drug called ""Z"" and sells it on campus, inadvertently resurrecting the living dead, who wreak havoc at a Halloween rave.","Comedy,Horror,Sci-Fi",,,
Hitler's Last Train,1977,,1h 15m,3.4,"The SS puts a slutty nightclub singer in charge of a train car full of prostitutes whose ""services"" are reserved solely for senior Nazis.","Drama,Thriller,War",,,
Black Eagle,1988,R,1h 33m,3.8,CIA agent must outrace KGB agent in searching of super weapon lost in Mediterranean.,"Action,Drama","$3,000,000 (estimated)",,
Delta Farce,2007,PG-13,1h 30m,3.6,Three bumbling Army reservists bound for Iraq are accidentally dropped at Mexican village besieged by hostile forces.,"Action,Adventure,Comedy","$8,130,530","$3,420,645","$8,729,473"
Jules Verne's Mysterious Island,2010,,1h 31m,3.5,"March 1865. A group of Union soldiers escape from Confederate hands in a balloon, accompanied by their former Confederate captor. The balloon crashes on a sinister island where they encounte...","Adventure,Fantasy,Horror","$1,175,000 (estimated)",,
Agnes,2021,,1h 33m,3.9,Rumors of demonic possession at a religious convent prompts a church investigation into the strange goings-on among its nuns. A disaffected priest and his neophyte are confronted with tempta...,"Drama,Horror","$2,113","$1,433","$506,133"
Return to Two Moon Junction,1995,R,1h 36m,3.9,A New York fashion model returns to her hometown in Georgia where she strikes up a lustful tryst with a handsome sculptor.,"Drama,Romance",,,
Howling III,1987,PG-13,1h 34m,3.5,"A female werewolf runs away from her family, and falls in love with a man who works in the movie business, while a sociologist who studies these creatures is looking for proof of their exist...","Comedy,Horror",,,
Inner Sanctum,1991,R,1h 30m,3.4,"A woman attempts suicide when she suspects her husband doesn't love her and is having an affair. Now she's wheelchair-bound, and her husband, who indeed doesn't love her and is having an aff...","Drama,Romance,Thriller",,,
13 Fanboy,2021,Not Rated,1h 41m,3.9,"An obsessed fan stalks his favorite actors from the Friday the 13th films and beyond, mirroring his idol Jason Voorhees.",Horror,"$105,507 (estimated)","$11,572","$11,572"
Generation Um...,2012,R,1h 37m,3.9,"Three adults during a single day in New York City filled with sex, drugs, and indecision.",Drama,"$1,700,000 (estimated)",,
Wicked Stepmother,1989,PG-13,1h 30m,3.9,A mother-and-daughter pair of witches wreaks havoc on a suburban family.,"Comedy,Fantasy","$2,500,000 (estimated)",,
Iron Eagle II,1988,PG,1h 45m,3.9,A joint U.S.- Soviet strike force is assembled to wipe out a nuclear base in an outlaw nation that plans to take the world hostage.,"Action,Drama,Romance","$10,497,324","$3,530,016","$10,497,324"
Methodic,2007,Not Rated,1h 37m,3.9,"Nick, a child haunted by ""The Dollman,"" goes mad, kills his parents, and is institutionalized. After twenty years, he escapes and continues his rampage disguised in a homemade Dollman outfit...","Action,Drama,Horror","$30,000 (estimated)",,
The Rookies,2019,,1h 53m,4.0,Extreme sport lover Zhou Feng got involved in an international illegal trade by accident. So he had to follow an international special agent Bruce to Budapest.,"Action,Adventure,Comedy",,,
Llamageddon,2015,,1h 9m,3.9,A killer llama from outer space crash lands on Earth and brings death and destruction to everyone in its path.,"Comedy,Sci-Fi",,,
Parasite,1982,R,1h 25m,4.0,"In a post-apocalyptic USA, a doctor/scientist infected with a new strain of parasite ends up in a small desert town, trying to find a cure.","Horror,Sci-Fi","$800,000 (estimated)","$2,270",
Creepozoids,1987,R,1h 12m,4.0,"A group of survivors try to avoid the battles of World War III. When they try to escape to the quiet lands, they encounter something much more deadly.","Horror,Sci-Fi","$75,000 (estimated)",,
Detective Knight: Redemption,2022,R,1h 37m,4.0,"In custody in New York, Detective James Knight finds himself in the middle of a jailbreak led by The Christmas Bomber, a brutal fanatic whose Santa Claus disciples are terrorizing the city. ...","Action,Adventure,Mystery","$192,939",,
Deadfall,1993,R,1h 38m,4.0,"When Joe loses his dad in a sting, he contacts his dad's twin, Lou, who has a major sting planned. Lou's helper feels threatened by Joe. Who's conning who?","Crime,Drama","$10,000,000 (estimated)","$18,369","$18,369"
Snag,2023,R,1h 23m,4.0,"A quiet, lonely Australian must find allies and enter a violent world to confront ruthless gangsters and save the love of his life after learning she was still alive.","Action,Mystery,Thriller",,,
Foreign Exchange,2008,R,1h 25m,4.0,"Four friends think they've got it made for senior year -- easy classes, booze-fueled ragers and ridiculously hot babes. But when they take in a group of foreign exchange students their maste...",Comedy,"$1,000,000 (estimated)",,
Swinging Wives,1971,R,1h 37m,4.0,An obsessed reporter interviews several Average-Joes who have encountered strange situations when meeting seductive married women. House calls will never be the same again when sexually repr...,Comedy,,,
Chinese Kamasutra,1994,,1h 25m,4.0,A sexy librarian named Joan is interning at a library in China. She keeps rejecting her co-worker's advances. There she finds a volume of the Kamasutra and everything will change for the bea...,"Fantasy,Romance",,,
Bats,1999,PG-13,1h 31m,4.0,Genetically mutated bats escape and it's up to a bat expert and the local sheriff to stop them.,"Horror,Sci-Fi,Thriller","$5,250,000 (estimated)","$10,155,690","$10,155,690"
Mata Hari,1985,R,1h 48m,4.0,"Mata Hari is a beautiful dancer of Dutch origin working in Paris. It is August 1914 and war between France and Germany seems imminent. However, she accepts an invitation to travel to Berlin ...","Drama,Thriller,War",,,
Free the Nipple,2013,Unrated,1h 18m,4.0,A group of women launch a movement to remove the censor of women's breasts all over America.,"Comedy,Drama","$937,000 (estimated)","$4,198","$4,198"
Redline,2007,PG-13,1h 35m,4.0,A gorgeous young automobile fanatic--and front to the hottest unsigned band on the West coast--finds herself caught up in illegal drag-racing competitions organized by exotic car fanatics.,Action,"$26,000,000 (estimated)","$6,881,022","$8,267,379"
Art of Love,2021,R,1h 56m,4.0,"A mysterious, erotic and haunting love story between a writer/professor at Puerto Rico's leading University and an aspiring artist from the immigrant Chinese community.","Romance,Thriller",,,
Ruslaan,2024,,2h,4.0,"The unstoppable force Ruslaan, is coming to break free of the chains of conformity. With his gun and guitar, he's about to create a symphony of rebellion like no other.","Action,Thriller",,,
The Girl on the Train,2021,TV-MA,2h,4.0,"The story follows a recent divorcee who spends her daily commute fantasizing about a seemingly perfect couple who live in a house that her train passes daily, but something shocking happens ...","Crime,Drama,Mystery",,,
Canta Y No Llores,2024,,1h 30m,4.0,"A matriarchal family runs a taco food truck, navigating between artistic aspirations and daily frustrations while raising a member's daughter.",Comedy,"$573,510",,
Emmanuelle 3,1977,R,1h 38m,4.0,Emmanuelle and her architect husband continue their amoral lifestyle in the Seychelles. But when a casual dalliance between her and a film director starts to turn serious her husband shows v...,"Drama,Romance",,,
Midnight Peepshow,2022,,1h 37m,4.0,A man stumbles across a darkly magical peepshow booth.,Horror,,,
Sex Weather,2018,,1h 29m,4.0,The two main characters work through their relationship in a moderately sexy time in bed. They had met again after two years when they worked together in Reality TV.,"Comedy,Drama,Romance",,,
Rhinestone,1984,PG,1h 51m,4.0,A country music star must turn an obnoxious New York cabbie into a singer in order to win a bet.,"Comedy,Music","$28,000,000 (estimated)","$21,435,321","$21,435,321"
Arsenal,2017,R,1h 32m,4.0,A Southern businessman attempts to rescue his kidnapped mobster brother.,"Action,Crime,Thriller","$10,000,000 (estimated)","$41,037",
Don't Suck,2023,,1h 40m,4.0,A veteran comedian's last chance at stardom takes him on the road with a young comic who reveals an unexpected past.,"Comedy,Drama",,,
Emanuelle's Revenge,2022,,1h 31m,4.0,"A rich playboy spends his time recklessly playing with women. After seducing and dropping model Francesca, he becomes infatuated with the mysterious Emanuelle, who proves to be equally decei...","Romance,Thriller",,,
Trog,1970,GP,1h 33m,4.0,A sympathetic anthropologist uses drugs and surgery to try to communicate with a primitive troglodyte who is found living in a local cave.,"Horror,Sci-Fi",,,
Boo 2! A Madea Halloween,2017,PG-13,1h 41m,4.0,"Madea, Bam, and Hattie venture to a haunted campground and the group must run for their lives when monsters, goblins, and the boogeyman are unleashed.","Comedy,Drama,Horror","$25,000,000 (estimated)","$47,319,572","$48,333,932"
The Outwaters,2022,Not Rated,1h 50m,4.0,Four travelers encounter menacing phenomena while camping in a remote stretch of the Mojave Desert.,"Horror,Sci-Fi,Thriller","$120,497","$204,496",
Agent Game,2022,R,1h 30m,4.0,A CIA officer finds himself the target of a rendition operation after being scapegoated for the death of an interrogation subject.,"Action,Thriller",,,
Frankenstein: Legacy,2024,,1h 41m,4.0,"England, 1875. A century after Victor Frankenstein's doomed experiment, his journals have traded hands for decades.","Drama,Thriller",,,
Private Property,2022,R,1h 27m,4.0,"Kathryn, a struggling actress and unfulfilled housewife, becomes involved with her new gardener, Ben. As he gives her the attention and sensitivity she craves, they start to fall for each ot...","Drama,Horror,Thriller","$22,149",,
Spring Lakes,2023,,1h 50m,4.0,"Struggling filmmaker Marcus searches for his missing sister in Spring Lakes, encountering a sinister cult and supernatural forces that took her.","Drama,Horror",,,
Rottentail,2018,TV-MA,1h 46m,4.0,"Peter Cotton, a scientist that works on rabbits and infertility, learns that the military wishes to use his work to create superhuman soldiers. Cotton is bitten by an experimental mutant rab...","Comedy,Horror","$3,383","$2,256","$3,383"
Ambush,2023,R,1h 44m,4.0,"A group of young elite commandos, led by Captain Drummond are tasked with collecting highly classified information that can change the fate of the war.","Action,Thriller","$26,305",,
Inseminoid,1981,R,1h 33m,4.0,"A crew of interplanetary archaeologists is threatened when an alien creature impregnates one of their members, causing her to turn homicidal and murder them one by one.","Horror,Sci-Fi","$2,000,000 (estimated)",,
Heaven in Hell,2023,,2h,4.0,"Olga and Maks are 15 years apart. She is a successful woman with an established position, mother of a young adult woman, he is a handsome young man devoted to enjoy life. Fate chooses them t...","Drama,Romance","$2,103,819",,
Martyrs,2015,Not Rated,1h 26m,4.0,A woman and her childhood friend seek out revenge on those who victimized and abused them.,"Drama,Horror,Thriller","$1,000,000 (estimated)","$397,072",
Too Much Love,2023,,1h 40m,4.0,"Coskun is a young man who sells pirated movies. While he is chasing after his love Ayla, he also tries to follow his passion for cinema.",Comedy,"$1,399,494",,
